{
  "$schema": "../schemas/access-control.schema.json",
  "pack": {
    "id": "pack.access-control.phase1",
    "version": "0.1.0-draft",
    "label": "Phase 1 authorization vocabulary seed",
    "description": "Disabled action, decision, permission, role, and policy definitions; the pack grants no authority and does not settle the production role matrix.",
    "meta_ref": "meta.security-draft",
    "retirement": {"state": "ACTIVE_DRAFT", "supersedes_ref": null, "replacement_ref": null, "retired_at": null},
    "decision_refs": ["DEC-035"],
    "contract_refs": ["SEC-AUTH-001", "SEC-ARCH-001", "SEC-AUD-001"],
    "attributes": {"runtime_enabled": false, "default_deny_required": true, "production_role_matrix_defined": false}
  },
  "actions": [
    {"id": "action.create", "version": "0.1.0-draft", "label": "Create", "description": "Create a governed resource through its owning workflow.", "meta_ref": "meta.security-draft", "retirement": {"state": "ACTIVE_DRAFT", "supersedes_ref": null, "replacement_ref": null, "retired_at": null}, "decision_refs": [], "contract_refs": ["AUTH-P1-012"], "attributes": {"code": "CREATE", "consequence_class": "WRITE", "runtime_enabled": false}},
    {"id": "action.read", "version": "0.1.0-draft", "label": "Read", "description": "Read an authorized resource or field with minimal disclosure.", "meta_ref": "meta.security-draft", "retirement": {"state": "ACTIVE_DRAFT", "supersedes_ref": null, "replacement_ref": null, "retired_at": null}, "decision_refs": [], "contract_refs": ["AUTH-P1-007", "AUTH-P1-012"], "attributes": {"code": "READ", "consequence_class": "READ", "runtime_enabled": false}},
    {"id": "action.edit", "version": "0.1.0-draft", "label": "Edit", "description": "Propose an additive governed edit; immutable evidence is not overwritten.", "meta_ref": "meta.security-draft", "retirement": {"state": "ACTIVE_DRAFT", "supersedes_ref": null, "replacement_ref": null, "retired_at": null}, "decision_refs": [], "contract_refs": ["AUTH-P1-012"], "attributes": {"code": "EDIT", "consequence_class": "WRITE", "runtime_enabled": false}},
    {"id": "action.resolve", "version": "0.1.0-draft", "label": "Resolve", "description": "Resolve a governed proposal or conflict without rewriting its evidence.", "meta_ref": "meta.security-draft", "retirement": {"state": "ACTIVE_DRAFT", "supersedes_ref": null, "replacement_ref": null, "retired_at": null}, "decision_refs": [], "contract_refs": ["AUTH-P1-012"], "attributes": {"code": "RESOLVE", "consequence_class": "WRITE", "runtime_enabled": false}},
    {"id": "action.compare", "version": "0.1.0-draft", "label": "Compare", "description": "Compare exact authorized versions and fields.", "meta_ref": "meta.security-draft", "retirement": {"state": "ACTIVE_DRAFT", "supersedes_ref": null, "replacement_ref": null, "retired_at": null}, "decision_refs": [], "contract_refs": ["AUTH-P1-012", "DIT-VER-P1-030"], "attributes": {"code": "COMPARE", "consequence_class": "READ", "runtime_enabled": false}},
    {"id": "action.supersede", "version": "0.1.0-draft", "label": "Supersede", "description": "Append a supersession decision under the owning aggregate.", "meta_ref": "meta.security-draft", "retirement": {"state": "ACTIVE_DRAFT", "supersedes_ref": null, "replacement_ref": null, "retired_at": null}, "decision_refs": [], "contract_refs": ["AUTH-P1-012", "DIT-VER-P1-017"], "attributes": {"code": "SUPERSEDE", "consequence_class": "WRITE", "runtime_enabled": false}},
    {"id": "action.share", "version": "0.1.0-draft", "label": "Share", "description": "Create or change an explicit scoped grant; relationship alone is not authority.", "meta_ref": "meta.security-draft", "retirement": {"state": "ACTIVE_DRAFT", "supersedes_ref": null, "replacement_ref": null, "retired_at": null}, "decision_refs": [], "contract_refs": ["AUTH-P1-012", "AUTH-P1-015"], "attributes": {"code": "SHARE", "consequence_class": "WRITE", "runtime_enabled": false}},
    {"id": "action.approve", "version": "0.1.0-draft", "label": "Approve", "description": "Issue a bound approval for exact reviewed inputs and effect.", "meta_ref": "meta.security-draft", "retirement": {"state": "ACTIVE_DRAFT", "supersedes_ref": null, "replacement_ref": null, "retired_at": null}, "decision_refs": [], "contract_refs": ["AUTH-P1-012", "AUTH-P1-014"], "attributes": {"code": "APPROVE", "consequence_class": "APPROVAL", "runtime_enabled": false}},
    {"id": "action.execute", "version": "0.1.0-draft", "label": "Execute", "description": "Execute an approved effect through the owning workflow; never directly from model output.", "meta_ref": "meta.security-draft", "retirement": {"state": "ACTIVE_DRAFT", "supersedes_ref": null, "replacement_ref": null, "retired_at": null}, "decision_refs": [], "contract_refs": ["AUTH-P1-012", "AUTH-P1-014", "AI-TOOL-P1-021"], "attributes": {"code": "EXECUTE", "consequence_class": "EXECUTION", "runtime_enabled": false}},
    {"id": "action.verify", "version": "0.1.0-draft", "label": "Verify", "description": "Verify evidence against an exact configured criterion.", "meta_ref": "meta.security-draft", "retirement": {"state": "ACTIVE_DRAFT", "supersedes_ref": null, "replacement_ref": null, "retired_at": null}, "decision_refs": [], "contract_refs": ["AUTH-P1-012", "AUTH-P1-014"], "attributes": {"code": "VERIFY", "consequence_class": "VERIFICATION", "runtime_enabled": false}},
    {"id": "action.export", "version": "0.1.0-draft", "label": "Export", "description": "Export only currently authorized content under a separate purpose and policy.", "meta_ref": "meta.security-draft", "retirement": {"state": "ACTIVE_DRAFT", "supersedes_ref": null, "replacement_ref": null, "retired_at": null}, "decision_refs": [], "contract_refs": ["AUTH-P1-012"], "attributes": {"code": "EXPORT", "consequence_class": "EXPORT", "runtime_enabled": false}},
    {"id": "action.trash", "version": "0.1.0-draft", "label": "Trash", "description": "Move availability to trash without claiming deletion.", "meta_ref": "meta.security-draft", "retirement": {"state": "ACTIVE_DRAFT", "supersedes_ref": null, "replacement_ref": null, "retired_at": null}, "decision_refs": [], "contract_refs": ["AUTH-P1-012", "DIT-VER-P1-032"], "attributes": {"code": "TRASH", "consequence_class": "DELETION", "runtime_enabled": false}},
    {"id": "action.restore", "version": "0.1.0-draft", "label": "Restore", "description": "Restore only when no authoritative deletion fence prevents it.", "meta_ref": "meta.security-draft", "retirement": {"state": "ACTIVE_DRAFT", "supersedes_ref": null, "replacement_ref": null, "retired_at": null}, "decision_refs": [], "contract_refs": ["AUTH-P1-012", "DIT-VER-P1-035"], "attributes": {"code": "RESTORE", "consequence_class": "DELETION", "runtime_enabled": false}},
    {"id": "action.purge", "version": "0.1.0-draft", "label": "Purge", "description": "Execute a governed deletion case; no duration or automatic completeness is implied.", "meta_ref": "meta.security-draft", "retirement": {"state": "ACTIVE_DRAFT", "supersedes_ref": null, "replacement_ref": null, "retired_at": null}, "decision_refs": ["DEC-039"], "contract_refs": ["AUTH-P1-012", "DIT-VER-P1-035"], "attributes": {"code": "PURGE", "consequence_class": "DELETION", "runtime_enabled": false}},
    {"id": "action.audit-read", "version": "0.1.0-draft", "label": "Audit read", "description": "Read privacy-filtered audit evidence without gaining content authority.", "meta_ref": "meta.security-draft", "retirement": {"state": "ACTIVE_DRAFT", "supersedes_ref": null, "replacement_ref": null, "retired_at": null}, "decision_refs": [], "contract_refs": ["AUTH-P1-012", "AUTH-P1-030"], "attributes": {"code": "AUDIT_READ", "consequence_class": "AUDIT", "runtime_enabled": false}}
  ],
  "policy_decisions": [
    {"id": "policy-decision.ALLOW", "version": "0.1.0-draft", "label": "Allow", "description": "Allow only the exact evaluated action/resource/field/purpose context.", "meta_ref": "meta.security-draft", "retirement": {"state": "ACTIVE_DRAFT", "supersedes_ref": null, "replacement_ref": null, "retired_at": null}, "decision_refs": [], "contract_refs": ["AUTH-P1-003"], "attributes": {"code": "ALLOW", "runtime_enabled": false}},
    {"id": "policy-decision.DENY", "version": "0.1.0-draft", "label": "Deny", "description": "Deny with precedence over ordinary allow and without existence disclosure.", "meta_ref": "meta.security-draft", "retirement": {"state": "ACTIVE_DRAFT", "supersedes_ref": null, "replacement_ref": null, "retired_at": null}, "decision_refs": [], "contract_refs": ["AUTH-P1-004"], "attributes": {"code": "DENY", "runtime_enabled": false}},
    {"id": "policy-decision.REDACT", "version": "0.1.0-draft", "label": "Redact", "description": "Return only the separately authorized redacted representation.", "meta_ref": "meta.security-draft", "retirement": {"state": "ACTIVE_DRAFT", "supersedes_ref": null, "replacement_ref": null, "retired_at": null}, "decision_refs": [], "contract_refs": ["AUTH-P1-007"], "attributes": {"code": "REDACT", "runtime_enabled": false}},
    {"id": "policy-decision.MINIMAL_DISCLOSURE", "version": "0.1.0-draft", "label": "Minimal disclosure", "description": "Return a safe policy-approved result that does not reveal hidden resource existence or value.", "meta_ref": "meta.security-draft", "retirement": {"state": "ACTIVE_DRAFT", "supersedes_ref": null, "replacement_ref": null, "retired_at": null}, "decision_refs": [], "contract_refs": ["AUTH-P1-005"], "attributes": {"code": "MINIMAL_DISCLOSURE", "runtime_enabled": false}}
  ],
  "permissions": [